{
  "repo_root": "/Users/tom/Developer/ablative/aion",
  "brief_id": "OBS-002",
  "reviewers": [
    "Waffles"
  ],
  "base_ref": "main",
  "placement": "local",
  "isolation": "worktree",
  "brief_document": {
    "id": "OBS-002",
    "cluster": "aion-observability",
    "title": "Propagate a child's terminal failure visibly to parent and watchers",
    "depends_on": [
      "OBS-001"
    ],
    "blocked_by": [],
    "checklist": [
      "C12",
      "C13",
      "C14",
      "C15",
      "C16",
      "C17",
      "C18"
    ],
    "stories": [
      "S4",
      "S5",
      "S6",
      "S7"
    ],
    "design_anchor": [
      "ADR-003",
      "ADR-005"
    ],
    "purpose": "Closes the other half of the dogfood observability gap: a child workflow's terminal failure must surface to the parent run and to watchers without hand-investigation (RM-024). The recorded ChildWorkflowFailed terminal \u2014 written onto the parent's history by the child-terminal watcher through the parent's Recorder (invariant 3, CN4) \u2014 already drives the parent's describe timeline and is already forwarded by the existing event-stream subscription; this brief adds the loud edge (an error log when the watcher records a failed-child terminal) and verifies the two visibility paths end to end (describe timeline carries the child id + reason; a subscribed watcher receives the parent-side event). It introduces no new event type and no new push path (CN3, design non-goals): propagation is expressed entirely over the existing recorded ChildWorkflowFailed. Depends on OBS-001 so the engine/server exit logging lands first; this brief layers the child-specific edge on top and re-verifies the shared invariant/gate items C16-C18 across its own diff.",
    "task": "Make a failed child loud and verifiably visible using the ChildWorkflowFailed event the watcher already records \u2014 no new event, no new push channel, no status field. Two parts: (1) Add an error-level tracing call in crates/aion/src/runtime/nif_child_watch.rs::record_parent_child_terminal at the point it records a ChildWorkflowFailed terminal (the TerminalOutcome::Failed arm, and the Cancelled/TimedOut arms that map to ChildWorkflowFailed), carrying parent workflow id, parent run id, child workflow id, and the child's WorkflowError.message \u2014 matching the warn/error lines run_watch already emits for transient and invariant record failures. The Completed arm must not log at error. The log is a pure side effect: it changes no recorded event and no returned RecordDisposition (CN5). (2) Verify the two existing visibility paths carry the failure: (a) a parent history containing a ChildWorkflowFailed is encoded into the describe response timeline by crates/aion-server/src/api/handlers/describe.rs and crates/aion-server/src/api/handlers/payload.rs::encode_history, with the child id and reason intact; (b) a watcher subscribed through the existing crates/aion-server/src/stream/ subscription receives the parent-side ChildWorkflowFailed event because it is a normal appended event. Scope boundary \u2014 in: the child-failure log in nif_child_watch.rs, tests asserting it, and tests verifying the describe-timeline and watcher-stream paths carry the failure; re-verification of shared invariant/gate items C16-C18 across this diff. Out: the engine exit funnel log and the server record_events terminal-failure logs (OBS-001); any new event type, status field, or push path; any change to how the watcher records (record-before-wake discipline, retry/backoff) \u2014 only a log is added. Split-item note: C16/C17/C18 are cluster-wide invariant/gate items shared with OBS-001; this brief re-verifies them across its own diff at the cluster landing commit.",
    "requirements": [
      {
        "id": "R1",
        "title": "Loud error log when the watcher records a failed-child terminal",
        "spec": "WHEN record_parent_child_terminal in crates/aion/src/runtime/nif_child_watch.rs records a ChildWorkflowFailed terminal for the parent \u2014 the TerminalOutcome::Failed arm, and the TerminalOutcome::Cancelled and TerminalOutcome::TimedOut arms that map to record_child_workflow_failed \u2014 THE SYSTEM SHALL emit an error-level tracing call carrying the parent workflow id, parent run id, child workflow id, and the recorded WorkflowError.message, consistent with the existing run_watch warn/error field conventions (parent_workflow_id, parent_run_id, child_workflow_id, reason/error via Display). THE SYSTEM SHALL NOT emit the error log on the TerminalOutcome::Completed arm, SHALL NOT emit it on the early-return ParentTerminal or AlreadyRecorded dispositions (no new terminal was recorded there), and SHALL NOT change the RecordDisposition returned or any event recorded (CN5).",
        "acceptance": [
          "On the TerminalOutcome::Failed arm, after record_child_workflow_failed succeeds, an ERROR-level tracing event is emitted carrying parent_workflow_id, parent_run_id, child_workflow_id, and the child's WorkflowError.message \u2014 asserted by a capturing-subscriber test driving record_parent_child_terminal with a Failed outcome and finding the ERROR record with the message text.",
          "On the TerminalOutcome::Completed arm, no ERROR-level child-failure record is emitted by record_parent_child_terminal.",
          "When record_parent_child_terminal returns AlreadyRecorded (the child terminal was already on the parent segment) or ParentTerminal, no new ERROR-level child-failure record is emitted (the failure is logged once, at the recording, mirroring P4).",
          "The Cancelled and TimedOut arms, which map to record_child_workflow_failed with the 'cancelled:'/'timed_out:' prefixed message, also emit the ERROR record carrying that message.",
          "cargo test -p aion passes including the new nif_child_watch logging test; the RecordDisposition returned by each arm is unchanged from before."
        ],
        "files": {
          "create": [],
          "modify": [
            "crates/aion/src/runtime/nif_child_watch.rs"
          ],
          "delete": []
        },
        "checklist": [
          "C12",
          "C13"
        ],
        "stories": [
          "S4",
          "S7"
        ]
      },
      {
        "id": "R2",
        "title": "Failed child surfaces on the parent's describe timeline",
        "spec": "THE SYSTEM SHALL surface a failed child on the parent run's describe output: WHEN a parent history contains a ChildWorkflowFailed event and describe is requested with history included, THE SYSTEM SHALL return a timeline that includes the encoded ChildWorkflowFailed carrying the child workflow id and the child's failure reason, via crates/aion-server/src/api/handlers/describe.rs and crates/aion-server/src/api/handlers/payload.rs::encode_history. This is a verification requirement over the existing describe path (status remains projected by status_from_events; CN1) \u2014 THE SYSTEM SHALL NOT add a new field to the describe response or a new event to carry the child failure; the existing ChildWorkflowFailed encoding is what is verified.",
        "acceptance": [
          "A test builds a parent history of WorkflowStarted, ChildWorkflowStarted, ChildWorkflowFailed (with a known child workflow id and a WorkflowError message), runs it through the describe handler with include_history true, and asserts the returned timeline contains the encoded ChildWorkflowFailed with the child workflow id and the reason text intact.",
          "The same describe response's summary status is derived by status_from_events (the parent is still Running if it has not itself terminated), confirming the child failure is visible in the timeline without being conflated into the parent's projected status.",
          "No new field is added to the describe response type and no new Event variant is introduced (diff review confirms the encoding of the existing ChildWorkflowFailed is what carries it).",
          "cargo test -p aion-server passes including the describe-timeline child-failure test."
        ],
        "files": {
          "create": [],
          "modify": [],
          "delete": []
        },
        "checklist": [
          "C14"
        ],
        "stories": [
          "S6"
        ]
      },
      {
        "id": "R3",
        "title": "Subscribed watcher receives the parent-side child-failure event",
        "spec": "THE SYSTEM SHALL deliver the parent-side ChildWorkflowFailed event to a watcher subscribed through the existing crates/aion-server/src/stream/ subscription surface, because the event is a normal appended event the stream already forwards through its namespace gate. This is a verification requirement over the existing push path \u2014 THE SYSTEM SHALL NOT add a new push channel, SSE endpoint, or notification integration (design non-goal): the deliverable is a test proving the existing stream carries the failed-child event to a subscriber.",
        "acceptance": [
          "A test subscribes through the existing event-subscription path, appends a ChildWorkflowFailed event for a workflow within the subscribed namespace, and asserts the subscriber's stream yields the encoded ChildWorkflowFailed event.",
          "The test asserts no new push path was needed: the event arrives through the same subscription/forward mechanism used for other appended events (the test imports only the existing stream API).",
          "An event for a different namespace is not delivered to the subscriber (the existing namespace gate still applies; the new visibility does not bypass authorization).",
          "cargo test -p aion-server passes including the watcher-stream child-failure test."
        ],
        "files": {
          "create": [],
          "modify": [],
          "delete": []
        },
        "checklist": [
          "C15"
        ],
        "stories": [
          "S5"
        ]
      },
      {
        "id": "R4",